PID,Description,Units,Data Type,Multiply,Divide,Add
0x4201,Ambient pressure,hPa,unsigned int,10,256,0
0x4205,Boost pressure,hPa,unsigned int,20,256,0
0x4206,Mass flow through throttle valve bank 1,kg/h,unsigned int,1,32,0
0x4300,Coolant temperature,°C,signed int,0.1,1,-273.14
0x4306,Confirmed target speed electr. water pump,1/min,unsigned char,1,1,0
0x4307,Status message electr. water pump,-,unsigned char,1,1,0
0x4310,Target temperature coolant,-,signed int,1,100,0
0x4402,Oil temperature after filter,°C,unsigned int,0.75,1,-48
0x4403,Fuel consumption since the last oil change,-,unsigned long,1,8192,0
0x4404,Kilometers of oil,km,unsigned int,10,1,0
0x4408,Oil temperature unfiltered,°C,signed int,0.1,1,-273.14
0x4409,Unfiltered oil level,mm,signed int,0.004,1,0
0x4411,Remaining distance derived from fuel consumption,-,signed int,1,0.1,0
0x4412,Oil life,mth,unsigned int,1,1,0
0x4421,Oil pressure regulator P component,-,signed int,2,65536,0
0x4422,Oil pressure regulator I component,-,signed int,2,65536,0
0x4423,Oil pressure regulator D component,-,signed int,2,65536,0
0x4425,Oil temperature in the sump,°C,signed int,1,10,0
0x4426,"Actual operating mode, oil pressure control",-,unsigned char,1,1,0
0x442C,Raw value oil level,mm,unsigned char,1,1,0
0x442F,Relative engine oil level in cl above minimum,cl,unsigned char,1,1,0
0x4436,Actual oil pressure value (absolute pressure),hPa,unsigned int,1,1,0
0x4501,Integrated offset stroke adaptation,-,signed int,0.001,1,0
0x4505,Target angle (inlet VANOS),° KW,signed int,1,128,0
0x4506,Angle of the inlet NW flanks relative to the crankshaft,° KW,signed int,0.02197266,1,0
0x4507,Angle of the outlet NW flanks relative to the crankshaft,° KW,signed int,0.02197266,1,0
0x4516,Status VVT stop learning (internal),-,unsigned char,1,1,0
0x4520,Effective engine power,-,unsigned int,1000,65536,0
0x4521,Fuel mass flow,kg/h,unsigned int,0.1,1,0
0x4522,"Fuel mass homogeneous as target value, cylinder 1",mg/stroke,unsigned int,1389,65535,0
0x4523,"Fuel mass homogeneous as target value, cylinder 2",mg/stroke,unsigned int,1389,65535,0
0x4524,"Fuel mass homogeneous as target value, cylinder 3",mg/stroke,unsigned int,1389,65535,0
0x4525,"Fuel mass homogeneous as target value, cylinder 4",mg/stroke,unsigned int,1389,65535,0
0x4526,"Fuel mass homogeneous as target value, cylinder 5",mg/stroke,unsigned int,1389,65535,0
0x4527,"Fuel mass homogeneous as target value, cylinder 6",mg/stroke,unsigned int,1389,65535,0
0x452A,Setpoint outlet spread variable NWS,° KW,signed int,1,10,0
0x452B,Setpoint inlet spread variable NWS,° KW,signed int,1,10,0
0x452C,Actual value of the outlet spread,° KW,signed int,1,10,0
0x452E,Actual value inlet spread,° KW,signed int,1,10,0
0x4530,"Injection mode, cylinder 1",-,unsigned char,1,1,0
0x4531,"Injection mode, cylinder 2",-,unsigned char,1,1,0
0x4532,"Injection mode, cylinder 3",-,unsigned char,1,1,0
0x4533,"Injection mode, cylinder 4",-,unsigned char,1,1,0
0x4534,"Injection mode, cylinder 5",-,unsigned char,1,1,0
0x4535,"Injection mode, cylinder 6",-,unsigned char,1,1,0
0x4536,Control difference boost pressure - bank-specific bank 1,hPa,signed int,125,1000,0
0x4537,Control difference boost pressure - bank-specific bank 2,hPa,signed int,0.125,1,0
0x4600,Throttle valve angle related to the lower stop,%,signed int,0.0078125,1,0
0x4601,"Target value for throttle valve angle, based on (lower) stop",%,unsigned int,100,65536,0
0x4603,Inlet valve lift setpoint filtered,mm,unsigned int,1,1000,0
0x4604,Output current of the machine,A,signed int,1,8,0
0x4606,Current battery current,A,unsigned int,0.08,1,-200
0x460D,Correction value shutdown,%,unsigned int,0.004,1,-100
0x460E,Distance to starting ability,%,unsigned int,0.004,1,-100
0x4617,Decreased moment of the electric machine,Nm,signed int,1,10,0
0x4650,Transmission temperature,°C,unsigned char,0.75,1,-48
0x4653,Sensor voltage position sensor electrical wastegate,V,unsigned int,80,65536,0
0x4654,Raw value position sensor electrical wastegate,mm,signed int,64,65536,0
0x4655,Sensor voltage position sensor electrical wastegate bank 2,V,unsigned int,80,65536,0
0x4656,Raw value position sensor electrical wastegate bank 2,mm,signed int,64,65536,0
0x4659,Should position EEC,mm,signed int,0.00097656,1,0
0x465A,Should position EWG 2,mm,signed int,0.00097656,1,0
0x4683,Speed gear input,1/min,unsigned int,0.1453421,1,0
0x4703,Offset corrected probe voltage in front of Kat of a broadband lambda probe bank 2,V,unsigned int,1,2048,0
0x4712,Number of dense EVAP systems recognized by diagnosis,-,unsigned char,1,1,0
0x4807,Engine speed,1/min,signed int,1,2,0
0x4808,Target idle speed,1/min,signed int,0.5,1,0
0x480B,Normalized accelerator pedal angle,%,signed int,0.01220703,1,0
0x480C,Target filling,%,unsigned int,0.75,32,0
0x480D,Is the longitudinal slope of the roadway,°,unsigned int,0.05,1,-64
0x4810,Is banked road surface,°,unsigned int,0.05,1,-64
0x4811,Vehicle longitudinal acceleration,m/s²,signed char,0.217,1,0
0x4812,Vehicle lateral acceleration (positive and negative),m/s²,signed int,1,640,0
0x48D0,Estimation of the distance until the OPF is fully loaded with ash,km,unsigned int,10,1,0
0x4A00,Average distance between critical DMF faults,km,unsigned int,1,1,0
0x4A01,Average value of the time interval between critical ZMS faults,min,unsigned int,10,1,0
0x4A12,Heating voltage in front of the cat of a broadband lambda probe (ADC value) bank 2,V,unsigned int,0.00488281,1,0
0x4A1D,Brake booster pressure sensor voltage,V,unsigned int,5,1024,0
0x4A21,Coolant temperature (sensor value) after low-pass filtering,°C,signed int,0.1,1,-273.14
0x4A2D,Intake manifold absolute pressure measured,hPa,unsigned int,20,256,0
0x4A30,Uneven running of cylinder 1,rad/s²,signed int,1,16,0
0x4A31,Uneven running cylinder 2,rad/s²,signed int,1,16,0
0x4A32,Uneven running cylinder 3,rad/s²,signed int,1,16,0
0x4A33,Uneven running cylinder 4,rad/s²,signed int,1,16,0
0x4A34,Uneven running cylinder 5,rad/s²,signed int,1,16,0
0x4A35,Uneven running cylinder 6,rad/s²,signed int,1,16,0
0x4A37,Normalized reference level knock control cylinder 1,V*ms,unsigned long,0.05,65536,0
0x4A38,Normalized reference level knock control cylinder 2,V*ms,unsigned long,0.05,65536,0
0x4A39,Normalized reference level knock control cylinder 3,V*ms,unsigned long,0.05,65536,0
0x4A3A,Normalized reference level knock control cylinder 4,V*ms,unsigned long,0.05,65536,0
0x4A3B,Normalized reference level of knock control cylinder 5,V*ms,unsigned long,0.05,65536,0
0x4A3C,Normalized reference level of knock control cylinder 6,V*ms,unsigned long,0.05,65536,0
0x4A43,Uneven running cylinder 7,rad/s²,signed int,1,16,0
0x4A44,Uneven running cylinder 8,rad/s²,signed int,1,16,0
0x4A45,Uneven running cylinder 9,rad/s²,signed int,1,16,0
0x4A46,Uneven running cylinder 10,rad/s²,signed int,1,16,0
0x4A47,Uneven running cylinder 11,rad/s²,signed int,1,16,0
0x4A48,Uneven running cylinder 12,rad/s²,signed int,1,16,0
0x4A49,Firing angle cylinder 1,° KW,signed int,1,10,0
0x4A4A,Firing angle cylinder 2,° KW,signed int,1,10,0
0x4A4C,Firing angle cylinder 3,° KW,signed int,1,10,0
0x4A4D,Firing angle cylinder 4,° KW,signed int,1,10,0
0x4A4E,Firing angle cylinder 5,° KW,signed int,1,10,0
0x4A4F,Firing angle cylinder 6,° KW,signed int,1,10,0
0x4A51,Lambda actual value sensor 1 bank 2,-,unsigned int,0.00024414,1,0
0x4A5B,Normalized heating output of lambda probe 2 behind cat bank 2,-,unsigned char,0.01,1,0
0x4A6C,Correction factor for the amount of fuel,%,signed char,1,1000,0
0x4A77,Output duty cycle for tank vent valve,%,unsigned int,100,65536,0
0x4A94,Saved camshaft target angle exhaust,° KW,signed int,0.015625,1,0
0x4A9D,Multiplicative mixture correction of the mixture adaptation,-,unsigned int,2,65536,0
0x4A9E,Multiplicative mixture correction of mixture adaptation bank 2,-,unsigned int,2,65536,0
0x4AB0,Boost pressure setpoint,hPa,unsigned int,10,256,0
0x4AB1,Vehicle speed,km/h,signed int,0.01,1,0
0x4ACC,Air damper - target position in steps,-,unsigned int,1,1,0
0x4ACD,Air damper - actual position in steps,-,unsigned int,1,1,0
0x4AD2,Air flap - upper air flap status,-,unsigned char,1,1,0
0x4AD3,Air flap - lower air flap status,-,unsigned char,1,1,0
0x4AD5,Fuel temperature,°C,unsigned char,0.75,1,-48
0x4AEB,Motor temperature less than 98 ° C,%,unsigned int,100,65536,0
0x4AEC,Motor temperature between 98 ° C and 112 ° C,%,unsigned int,100,65536,0
0x4AED,Motor temperature between 113 ° C and 120 ° C,%,unsigned int,100,65536,0
0x4AEE,Motor temperature between 121 ° C and 125 ° C,%,unsigned int,100,65536,0
0x4AEF,Motor temperature greater than 125 ° C,%,unsigned int,100,65536,0
0x4AF0,Temperature less than 80 ° C,%,unsigned int,100,65536,0
0x4AF4,Temperature greater than 150 ° C,%,unsigned int,100,65536,0
0x4AF5,Gearbox temperature less than 80 ° C,%,unsigned int,100,65536,0
0x4AF6,Gearbox temperature between 80 ° C and 109 ° C,%,unsigned int,100,65536,0
0x4AF7,Gearbox temperature between 110 ° C and 124 ° C,%,unsigned int,100,65536,0
0x4AF8,Gearbox temperature between 125 ° C and 129 ° C,%,unsigned int,100,65536,0
0x4AF9,Gearbox temperature greater than 129 ° C,%,unsigned int,100,65536,0
0x4AFA,Ambient temperature less than 3 ° C,%,unsigned int,100,65536,0
0x4AFB,Ambient temperature between 3 ° C and 19 ° C,%,unsigned int,100,65536,0
0x4AFC,Ambient temperature between 20 ° C and 29 ° C,%,unsigned int,100,65536,0
0x4AFD,Ambient temperature between 30 ° C and 39 ° C,%,unsigned int,100,65536,0
0x4AFE,Ambient temperature greater than 39 ° C,%,unsigned int,100,65536,0
0x4B23,Misfire detection counter cylinder 1,-,unsigned int,1,1,0
0x4B24,Misfire detection counter cylinder 2,-,unsigned int,1,1,0
0x4B25,Misfire detection counter cylinder 3,-,unsigned int,1,1,0
0x4B30,Misfire detection counter cylinder 4,-,unsigned int,1,1,0
0x4B31,Misfire detection counter cylinder 5,-,unsigned int,1,1,0
0x4B32,Misfire detection counter cylinder 6,-,unsigned int,1,1,0
0x4B33,Misfire detection counter cylinder 7,-,unsigned int,1,1,0
0x4B34,Misfire detection counter cylinder 8,-,unsigned int,1,1,0
0x4B35,Misfire detection counter cylinder 9,-,unsigned int,1,1,0
0x4B40,Misfire detection counter cylinder 10,-,unsigned int,1,1,0
0x4B41,Misfire detection counter cylinder 11,-,unsigned int,1,1,0
0x4B42,Misfire detection counter cylinder 12,-,unsigned int,1,1,0
0x4B50,Cylinder-specific angular acceleration cylinder 1,rad/s²,signed int,0.0625,1,0
0x4B51,Cylinder-specific angular acceleration cylinder 2,rad/s²,signed int,0.0625,1,0
0x4B52,Cylinder-specific angular acceleration cylinder 3,rad/s²,signed int,0.0625,1,0
0x4B53,Cylinder-specific angular acceleration cylinder 4,rad/s²,signed int,0.0625,1,0
0x4B54,Cylinder-specific angular acceleration cylinder 5,rad/s²,signed int,0.0625,1,0
0x4B55,Cylinder-specific angular acceleration cylinder 6,rad/s²,signed int,0.0625,1,0
0x4B56,Cylinder-specific angular acceleration cylinder 7,rad/s²,signed int,0.0625,1,0
0x4B57,Cylinder-specific angular acceleration cylinder 8,rad/s²,signed int,0.0625,1,0
0x4B64,Cylinder-specific angular acceleration cylinder 9,rad/s²,signed int,0.0625,1,0
0x4B65,Cylinder-specific angular acceleration cylinder 10,rad/s²,signed int,0.0625,1,0
0x4B66,Cylinder-specific angular acceleration cylinder 11,rad/s²,signed int,0.0625,1,0
0x4B67,Cylinder-specific angular acceleration cylinder 12,rad/s²,signed int,0.0625,1,0
0x541D,External charge detected during sleep phase,0/1,unsigned char,1,1,0
0x541E,External charging active,0/1,unsigned char,1,1,0
0x5421,Voltage requirement 12V basis,V,unsigned int,0.001,1,0
0x5422,Reference point for the voltage requirement 12V basis,-,unsigned char,1,1,0
0x5433,Oxygen storage capacity of the catalyst 1 bank 1,mg,unsigned int,0.1,1,0
0x5434,Oxygen storage capacity of catalyst 1 bank 2,mg,unsigned int,0.1,1,0
0x5441,"Lambda offset (sensor 1, bank 2)",-,signed int,0.00003052,1,0
0x5442,Injection current maximum fuel mass flow injectors,-,unsigned int,0.00390625,1,0
0x5443,Information about motoring out,0-n,unsigned char,1,1,0
0x5444,Soot mass in OPF Bank 1,g,signed int,0.01,1,0
0x5445,Soot mass in OPF bank 2,g,signed int,0.01,1,0
0x5446,Adapted ash mass in OPF Bank 1,g,signed int,0.0078125,1,0
0x5447,Adapted ash mass in OPF Bank 2,g,signed int,0.0078125,1,0
0x5448,Adapted total loading of the OPF Bank 1,g,signed int,0.0078125,1,0
0x5449,Adapted total loading of the OPF Bank 2,g,signed int,0.0078125,1,0
0x5452,Oil level min recognition last level (flash-resistant),mm,unsigned int,0.29296875,1,0
0x5457,Key refill quantity,l,unsigned char,0.1,1,-12.8
0x5458,Refill quantity for the engine oil,-,unsigned char,0.1,1,0
0x5463,Low fuel pressure sensor Raw fuel pressure value,hPa,signed int,1,1,0
0x5476,48V on-board network status,-,unsigned char,1,1,0
0x5477,48V on-board network status relay,-,unsigned char,1,1,0
0x547A,State of charge 48V battery,%,unsigned char,0.5,1,0
0x547B,Current battery voltage 48V battery,V,unsigned int,0.02,1,0
0x547C,Current battery current 48V battery,A,unsigned int,0.025,1,-819.15
0x547E,48V electrical system discharge protection,-,unsigned char,1,1,0
0x547F,48V on-board network generator current,A,signed int,0.2,1,0
0x5480,48V electrical system generator voltage,V,unsigned int,0.1,1,0
0x5481,"48V on-board power supply, long drive discharge power",W,signed int,1,1,0
0x5482,48V on-board network discharge power drive medium,W,signed int,1,1,0
0x5483,"48V on-board network, short drive discharge power",W,signed int,1,1,0
0x5484,"48V on-board power supply, medium charging power",W,signed int,1,1,0
0x5485,"48V on-board power supply, short drive power",W,signed int,1,1,0
0x5486,Crankshaft position at the start command,° KW,unsigned int,0.0234375,1,0
0x5489,Extrapolation of the remaining distance of the spark plug set,km,signed int,100,1,0
0x548A,Status generator diagnosis extended,-,unsigned int,1,1,0
0x549E,Water injection pre-FS metering valve duty cycle,%,unsigned int,0.1,1,0
0x549F,Water injection pre-FS engine shut-off valve,-,unsigned char,1,1,0
0x54A0,Water injection pre-FS vent valve,%,unsigned int,0.1,1,0
0x54A1,Water injection pre-FS target water mass flow (sum of the two banks),kg/h,unsigned int,0.03125,1,0
0x54A2,Pre-FS water injection Relative water pressure,hPa,signed int,1,1,0
0x54A3,Water injection Frost counter Water pressure sensor,-,unsigned int,1,1,0
0x54A7,Water level water control device,%,unsigned char,10,1,0
0x54A8,Water level Available water control unit,l,unsigned int,0.01,1,0
0x54B6,Simulated mean temperature OPF bank 1,°C,signed int,0.1,1,-273.14
0x54B7,Measured temperature before OPF,°C,signed int,0.1,1,-273.14
0x54B8,Measured temperature according to OPF,°C,signed int,0.1,1,-273.14
0x54BF,Simulated printing according to OPF Bank 1,hPa,unsigned int,0.0390625,1,0
0x54C0,Frequency counter actuation of ventilation valve,-,unsigned int,1,1,0
0x54C2,Frequency counter actuation of engine shut-off valve,-,unsigned int,1,1,0
0x54C4,Frequency counter actuation of dosing valve 1,-,unsigned int,1,1,0
0x54C6,Frequency counter actuation of dosing valve 2,-,unsigned int,1,1,0
0x550B,Current fuel viscosity,-,unsigned int,0.00005,1,0
0x550D,Percent alcohol in fuel,%,unsigned char,0.39215686,1,0
0x550E,Current injection counter reading since the very beginning,-,unsigned long,1,1,0
0x550F,Shutdown time,s,signed long,1,1,0
0x5511,Air mass flow participating in combustion,kg/h,signed int,0.1,1,0
0x5512,Ambient temperature,°C,unsigned char,0.5,1,-40
0x5513,Ambient temperature unfiltered,°C,unsigned char,0.5,1,-40
0x5514,Physical raw value ambient temperature,°C,signed int,0.1,1,-273.14
0x5515,"Measured engine temperature in the first start of the driving cycle, linearized and converted",°C,signed int,0.1,1,-273.14
0x5516,Maximum engine temperature that has occurred,°C,signed int,0.1,1,-273.14
0x5517,Minimum engine temperature that occurred,°C,signed int,0.1,1,-273.14
0x5518,Minimum value raw value of the intake air temperature,°C,signed int,0.1,1,-273.14
0x5519,Maximum value Raw value of the intake air temperature,°C,signed int,0.1,1,-273.14
0x551A,Model-calculated maximum intake air temperature,°C,signed int,0.1,1,-273.14
0x552E,Status of frictional connection in monitoring function,0/1,unsigned char,1,1,0
0x5531,Coordinated target torque on the wheel,Nm,signed int,1,1,0
0x5532,Translational acceleration,m/s²,signed int,0.001,1,0
0x5533,Acceleration of the secondary axis,m/s²,signed int,0.001,1,0
0x5534,Status emergency running of entire engine,-,unsigned long,1,1,0
0x5536,Status clutch K0,-,unsigned char,1,1,0
0x5537,Speed electric motor,-,unsigned int,0.5,1,-5000
0x553A,Acceleration of the primary axis,m/s²,signed int,0.001,1,0
0x553B,Target wheel torque from accelerator pedal request,Nm,signed int,1,1,0
0x553C,Torque limitation status,-,unsigned long,1,1,0
0x5541,Actual gear in the monitoring function from gear sensor,-,unsigned char,1,1,0
0x5549,Voltage additional power storage,V,unsigned int,0.001,1,0
0x554B,Irregular burns event counter,-,unsigned char,1,1,0
0x5559,Measured crankcase ventilation pressure,hPa,signed int,0.01,1,0
0x5562,Setpoint eccentric angle VVT,°,signed int,0.1,1,0
0x556F,Charge status of additional power storage,%,unsigned char,1,1,0
0x5571,Temperature additional storage tank,°C,unsigned char,1,1,-127
0x5572,Electricity additional storage,A,unsigned int,0.05,1,-1638.35
0x5578,Factor estimated ZK sooting,-,unsigned int,0.00001526,1,0
0x5582,Ash influence bank 2,-,signed int,0.001,1,0
0x5583,Soot mass particle filter bank 2,g,signed int,0.001,1,0
0x5584,Sensed differential pressure after the particulate filter bank 2,hPa,signed int,1,1,0
0x5585,Raw voltage value from ADC Bank 2,mV,signed int,0.2,1,0
0x558B,Adapted ash mass in the particle filter,-,signed int,0.001,1,0
0x558C,Adapted total loading of the particle filter,-,signed int,0.001,1,0
0x558E,Mileage fuel delivery module,km,signed long,1,1,0
0x558F,Operating hours of fuel delivery module,h,unsigned long,0.5,1,0
0x5598,Adapted ash mass in the particulate filter bank 2,-,signed int,0.001,1,0
0x5599,Adapted total loading of the particulate filter bank 2,-,signed int,0.001,1,0
0x559C,Raw value position lower mechanical stop electrical wastegate (WG closed) bank 2,mm,signed int,0.00097656,1,0
0x559D,Raw value position upper mechanical stop electrical wastegate (flat share open) bank 2,mm,signed int,0.00097656,1,0
0x559F,Operating status of electrical wastegate bank 2,-,unsigned char,1,1,0
0x55A4,Counter estimated burn-free processes of the spark plug soot,-,unsigned int,1,1,0
0x55A5,Rudimentarily estimated spark plug temperature,°C,signed int,0.1,1,-273.14
0x55C8,Temperature sensor in front of OPF bank 1,°C,signed int,0.1,1,-273.14
0x55C9,Voltage raw value temperature sensor in front of OPF bank 1,mV,signed int,0.2,1,0
0x55CB,Temperature temperature sensor in front of OPF bank 2,°C,signed int,0.1,1,-273.14
0x55CC,Voltage raw value temperature sensor in front of OPF bank 2,mV,signed int,0.2,1,0
0x55CE,Temperature sensor behind OPF bank 1,°C,signed int,0.1,1,-273.14
0x55CF,Voltage raw value temperature sensor behind OPF bank 1,mV,signed int,0.2,1,0
0x55D1,Temperature sensor behind OPF bank 2,°C,signed int,0.1,1,-273.14
0x55D2,Voltage raw value temperature sensor behind OPF bank 2,mV,signed int,0.2,1,0
0x5607,Actual speed,-,unsigned char,1,1,0
0x5608,Supply voltage,V,signed int,0.1,1,0
0x5609,Power consumption,A,unsigned char,0.2,1,0
0x560A,Temperature on the electronics,°C,signed int,1,1,-50
0x5615,Status learning process misfire detection,-,unsigned char,1,1,0
0x5616,Differential temperature of the respective cooling requirement,-,signed int,0.01,1,0
0x5617,Differential temperature of the respective cooling requirement when switching off,-,signed int,0.01,1,0
0x5618,Filtered fuel flow,%,signed int,0.01,1,0
0x5621,Rail pressure corrected by the learned rail pressure sensor offset,MPa,unsigned int,5,8192,0
0x5624,Current output ignition angles,° KW,signed char,0.75,1,0
0x5626,Actual value outlet spread bank 2,° KW,signed int,0.1,1,0
0x5627,Actual value inlet spread bank 2,° KW,signed int,0.1,1,0
0x5629,Mass flow HFM 16-bit size bank 2,kg/h,unsigned int,0.1,1,0
0x562A,"Intake air temperature, linearized and converted, bank 2",°C,unsigned char,0.75,1,-48
0x562C,Basic electrical system generator voltage,V,unsigned int,0.001,1,0
0x562D,Basic electrical system generator power,A,signed int,1,1,0
0x562E,Basic electrical system producer status,-,unsigned char,1,1,0
0x562F,Basic electrical system converter current,A,signed int,1,1,0
0x5634,Supply voltage DME,mV,signed int,1,0.05,0
0x563B,Current value stoichiometric ratio,-,unsigned int,0.00024414,1,0
0x5640,Actual lambda from probe,-,unsigned int,0.00024414,1,0
0x5642,Moment reserve,Nm,unsigned int,0.5,1,-1023
0x5643,Torque of torque adaptation,-,signed int,0.1,1,0
0x564F,Internal gear (including neutral and reverse),-,unsigned char,1,1,0
0x5652,Status bit whether IGR high active,-,unsigned char,1,1,0
0x5653,Status bit whether IGR medium is active,-,unsigned char,1,1,0
0x5655,Default generator setpoint voltage (output value),V,unsigned int,0.1,1,0
0x5656,Volume flow of fuel,ml/s,unsigned int,0.00119209,1,0
0x5658,Filtered rail pressure actual value (absolute pressure),MPa,unsigned int,0.002,1,0
0x5665,Output duty cycle for the controller,%,signed int,0.01,1,0
0x56A5,Lithium ion starter battery - voltage cell 1,V,unsigned int,0.001,1,1
0x56A6,Lithium ion starter battery - voltage cell 2,V,unsigned int,0.001,1,1
0x56A7,Lithium ion starter battery - voltage cell 3,V,unsigned int,0.001,1,1
0x56A8,Lithium ion starter battery - voltage cell 4,V,unsigned int,0.001,1,1
0x56A9,Lithium ion starter battery - status symmetrization,-,unsigned char,1,1,0
0x56AA,Lithium-ion starter battery - degree of desymmetrization of the memory,-,unsigned char,1,1,0
0x56AB,Lithium ion starter battery - deep discharge status (with single cell status at LISB),-,unsigned char,1,1,0
0x56AC,Lithium ion starter battery - maximum allowable discharge current,A,unsigned int,1,1,0
0x56AD,Lithium ion starter battery - maximum permissible charging current,A,unsigned int,1,1,0
0x56AE,Lithium ion starter battery - nominal voltage of the storage unit,V,unsigned int,0.001,1,0
0x56AF,Lithium ion starter battery - quality value internal resistance,mOhm,unsigned char,0.002,1,0
0x56B6,Average of the pressure sensor values of all existing pressure sensors,hPa,unsigned int,0.125,1,0
0x56B8,Status pressure sensor diagnosis (1: motor is stationary 2: motor in LL 3: motor in VL 0: no dual comparison possible),-,unsigned char,1,1,0
0x56C1,Setpoint rail pressure control,MPa,unsigned int,0.002,1,0
0x56C2,Filtered actual rail pressure value from CAN (absolute pressure),MPa,unsigned int,0.002,1,0
0x56D5,Voltage behind injection / ignition relay,V,signed int,0.001,1,0
0x56D7,Unfiltered rail pressure actual value (abs.),MPa,unsigned int,0.002,1,0
0x56DA,Pressure value of the crankcase differential pressure sensor,hPa,signed int,0.01,1,0
0x56DB,Crankcase differential pressure sensor voltage,mV,signed int,0.2,1,0
0x56DD,Difference between pressure value sensor and model,hPa,signed int,0.0390625,1,0
0x56E0,Adapted crankcase ventilation pressure,hPa,signed int,0.01,1,0
0x56E1,Output duty cycle for the controller,-,signed int,0.01,1,0
0x56ED,Pole voltage of the storage,V,unsigned int,0.001,1,0
0x56EE,Current of memory,A,signed int,0.05,1,0
0x56EF,Storage tank temperature,°C,signed char,1,1,0
0x56F0,SOC of the memory,%,signed char,1,1,0
0x56F1,SOC Quality value of the memory,%,signed char,1,1,0
0x56F2,Cell voltage cell 1,V,unsigned int,0.001,1,0
0x56F3,Cell voltage cell 2,V,unsigned int,0.001,1,0
0x56F4,Cell voltage cell 3,V,unsigned int,0.001,1,0
0x56F5,Cell voltage cell 4,V,unsigned int,0.001,1,0
0x56F6,Cell voltage cell 5,V,unsigned int,0.001,1,0
0x56F7,Cell voltage cell 6,V,unsigned int,0.001,1,0
0x56FA,Maximum permissible vehicle acceleration,m/s²,signed int,0.001,1,0
0x5700,Desired torque transmission input main drive axle without driving dynamics filtering,Nm,signed int,0.1,1,0
0x5705,Assembly mode currently active,0/1,unsigned char,1,1,0
0x5734,Status of transmission interventions via CAN,-,unsigned char,1,1,0
0x573A,Target differential pressure intake manifold,hPa,signed int,0.0390625,1,0
0x573C,Differential pressure in front of the throttle valve between the start and the end of the dynamic test SSP,hPa,signed int,0.078125,1,0
0x575F,Relative SOC,-,signed int,0.0001,1,0
0x5761,Clutch temperature,-,signed int,0.015625,1,0
0x576A,Raw value position of upper mechanical stop from electrical wastegate (flat share open),mm,signed int,0.00097656,1,0
0x576B,Raw value position of the lower mechanical stop from the electrical wastegate (WG closed),mm,signed int,0.00097656,1,0
0x5773,Ash influence,-,signed int,0.001,1,0
0x5774,Soot mass in the particle filter,g,signed int,0.001,1,0
0x5784,Operating time since the last successful regeneration,s,signed long,1,1,0
0x5788,E-fan target speed from WMK,%,unsigned char,0.390625,1,0
0x578C,Temperature raw value of the intake air temperature sensor 3,°C,signed int,0.1,1,-273.14
0x579B,Temperature in the particulate filter bank 1,°C,signed int,0.1,1,-273.14
0x579E,Temperature in the particulate filter bank 2,°C,signed int,0.1,1,-273.14
0x57A0,Reference torque for misfire detection,%,unsigned int,0.00152588,1,0
0x57A1,Target air mass flow,kg/h,unsigned int,0.1,1,0
0x57A4,Total start counter,-,unsigned long,1,1,0
0x57A9,Raw pressure value pressure sensor gasoline particle filter,hPa,signed int,1,1,0
0x57AE,Setpoint speed E-fan default WM,%,unsigned int,0.00152588,1,0
0x57B5,Generator speed,1/min,unsigned int,1,1,0
0x57C3,Inlet spread,° KW,signed int,1,10,0
0x57C9,Raw voltage value of the pressure sensor Otto particle filter from the ADC,mV,signed int,0.2,1,0
0x57CA,Intake manifold pressure measured with pressure sensor on the intake manifold (DS-S),hPa,unsigned int,0.0390625,1,0
